#character,location,waittime,duration,comment0,0,10,5,Let's explore the estuary together.0,0,16,8,There's lots of life in the top layer of soil in an estuary.0,0,27,8,The blue organisms thrive or die because of the pH level.0,0,38,8,The pH levels vary natrually between estuaries.0,0,49,8,Hold your hand over the left slider to change the pH0,0,63,8,The green organisms thrive or die because of pollution.0,0,74,8,Pollution is caused by urban and agricultural activity.0,0,85,8,Hold your hand over the left slider to change the Pollution level