#character,location,waittime,duration,comment0,0,10,5,Let's explore the estuary together.0,0,16,8,There's lots of life in the top layer of soil in an estuary.0,0,27,8,Some organisms thrive or die because of the pH level.0,0,38,8,The pH level varies natrually between estuaries.0,0,49,8,You can change it by holding your hand over the slider on the left.0,0,60,8,Other organisms thrive or die because of pollution.0,0,71,8,Pollution is caused by urban and agricultural activity.0,0,82,8,You can change it by holding your hand over the slider on the right.